{
  "type": "perception.frame",
  "schemaVersion": 2,
  "seq": 458,
  "sessionId": "video-b23adb0d-8a7aaced-20260926T033002-c47ea5",
  "source": {
    "kind": "video",
    "id": "b23adb0d-8a7aaced"
  },
  "frameIndex": 458,
  "ptsSeconds": 15.09,
  "serverTimeMs": 1790411418013,
  "processingMs": 95.7,
  "image": {
    "width": 1280,
    "height": 720
  },
  "camera": {
    "focalPx": 700.0,
    "principalPoint": [
      640.0,
      360.0
    ],
    "horizonY": 198.2,
    "cameraHeightMeters": 1.758
  },
  "objects": [
    {
      "id": 46,
      "class": "car",
      "bbox": [
        1036.0,
        280.7,
        1280.0,
        554.0
      ],
      "confidence": 0.659,
      "ageFrames": 45,
      "distanceMeters": 4.01,
      "distanceMethod": "depth_model",
      "distanceConfidence": 0.6,
      "lateralMeters": 2.48,
      "ttcSeconds": null,
      "approaching": false,
      "inEgoPath": false,
      "lightState": null,
      "lightConfidence": null,
      "distanceAgeMs": 233.3
    },
    {
      "id": 50,
      "class": "car",
      "bbox": [
        426.0,
        213.8,
        534.0,
        294.2
      ],
      "confidence": 0.85,
      "ageFrames": 42,
      "distanceMeters": 15.45,
      "distanceMethod": "fused",
      "distanceConfidence": 0.879,
      "lateralMeters": -3.03,
      "ttcSeconds": 0.97,
      "approaching": false,
      "inEgoPath": false,
      "lightState": null,
      "lightConfidence": null,
      "distanceAgeMs": 233.3
    },
    {
      "id": 52,
      "class": "car",
      "bbox": [
        692.7,
        213.5,
        782.0,
        282.2
      ],
      "confidence": 0.774,
      "ageFrames": 40,
      "distanceMeters": 16.85,
      "distanceMethod": "fused",
      "distanceConfidence": 0.879,
      "lateralMeters": 2.05,
      "ttcSeconds": 1.78,
      "approaching": true,
      "inEgoPath": false,
      "lightState": null,
      "lightConfidence": null,
      "distanceAgeMs": 233.3
    },
    {
      "id": 61,
      "class": "car",
      "bbox": [
        662.7,
        201.7,
        692.0,
        239.7
      ],
      "confidence": 0.444,
      "ageFrames": 22,
      "distanceMeters": 35.74,
      "distanceMethod": "fused",
      "distanceConfidence": 0.869,
      "lateralMeters": 1.91,
      "ttcSeconds": 2.87,
      "approaching": true,
      "inEgoPath": false,
      "lightState": null,
      "lightConfidence": null,
      "distanceAgeMs": 233.3
    },
    {
      "id": 62,
      "class": "car",
      "bbox": [
        316.0,
        221.5,
        401.3,
        276.2
      ],
      "confidence": 0.67,
      "ageFrames": 17,
      "distanceMeters": 20.78,
      "distanceMethod": "fused",
      "distanceConfidence": 0.832,
      "lateralMeters": -7.5,
      "ttcSeconds": 2.74,
      "approaching": false,
      "inEgoPath": false,
      "lightState": null,
      "lightConfidence": null,
      "distanceAgeMs": 233.3
    },
    {
      "id": 63,
      "class": "car",
      "bbox": [
        617.3,
        192.8,
        637.3,
        210.5
      ],
      "confidence": 0.321,
      "ageFrames": 13,
      "distanceMeters": 68.06,
      "distanceMethod": "fused",
      "distanceConfidence": 0.857,
      "lateralMeters": -1.3,
      "ttcSeconds": 12.51,
      "approaching": false,
      "inEgoPath": false,
      "lightState": null,
      "lightConfidence": null,
      "distanceAgeMs": 233.3
    },
    {
      "id": 64,
      "class": "car",
      "bbox": [
        376.7,
        204.0,
        444.7,
        267.3
      ],
      "confidence": 0.43,
      "ageFrames": 10,
      "distanceMeters": 24.09,
      "distanceMethod": "fused",
      "distanceConfidence": 0.845,
      "lateralMeters": -7.04,
      "ttcSeconds": 1.8,
      "approaching": false,
      "inEgoPath": false,
      "lightState": null,
      "lightConfidence": null,
      "distanceAgeMs": 233.3
    },
    {
      "id": 1000056,
      "class": "traffic light",
      "bbox": [
        568.7,
        154.7,
        580.0,
        170.0
      ],
      "confidence": 0.453,
      "ageFrames": 33,
      "distanceMeters": 22.2,
      "distanceMethod": "size_prior",
      "distanceConfidence": null,
      "lateralMeters": -2.08,
      "ttcSeconds": null,
      "approaching": null,
      "inEgoPath": null,
      "lightState": "GREEN",
      "lightConfidence": 0.988,
      "distanceAgeMs": 0.0
    },
    {
      "id": 1000057,
      "class": "traffic sign",
      "bbox": [
        821.3,
        95.7,
        866.7,
        139.0
      ],
      "confidence": 0.765,
      "ageFrames": 28,
      "distanceMeters": 16.7,
      "distanceMethod": "size_prior",
      "distanceConfidence": null,
      "lateralMeters": 4.87,
      "ttcSeconds": null,
      "approaching": null,
      "inEgoPath": null,
      "lightState": null,
      "lightConfidence": null,
      "distanceAgeMs": 0.0
    },
    {
      "id": 1000061,
      "class": "traffic light",
      "bbox": [
        680.7,
        1.8,
        702.0,
        51.7
      ],
      "confidence": 0.591,
      "ageFrames": 23,
      "distanceMeters": 15.0,
      "distanceMethod": "size_prior",
      "distanceConfidence": null,
      "lateralMeters": 1.1,
      "ttcSeconds": null,
      "approaching": null,
      "inEgoPath": null,
      "lightState": "GREEN",
      "lightConfidence": 0.988,
      "distanceAgeMs": 0.0
    },
    {
      "id": 1000062,
      "class": "traffic sign",
      "bbox": [
        820.0,
        140.8,
        861.3,
        156.9
      ],
      "confidence": 0.639,
      "ageFrames": 23,
      "distanceMeters": null,
      "distanceMethod": null,
      "distanceConfidence": null,
      "lateralMeters": null,
      "ttcSeconds": null,
      "approaching": null,
      "inEgoPath": null,
      "lightState": null,
      "lightConfidence": null,
      "distanceAgeMs": null
    },
    {
      "id": 1000063,
      "class": "traffic light",
      "bbox": [
        626.3,
        155.7,
        637.0,
        172.0
      ],
      "confidence": 0.417,
      "ageFrames": 23,
      "distanceMeters": 23.6,
      "distanceMethod": "size_prior",
      "distanceConfidence": null,
      "lateralMeters": -0.28,
      "ttcSeconds": null,
      "approaching": null,
      "inEgoPath": null,
      "lightState": "GREEN",
      "lightConfidence": 0.988,
      "distanceAgeMs": 0.0
    },
    {
      "id": 1000066,
      "class": "traffic light",
      "bbox": [
        659.3,
        4.1,
        679.3,
        50.8
      ],
      "confidence": 0.628,
      "ageFrames": 14,
      "distanceMeters": 16.0,
      "distanceMethod": "size_prior",
      "distanceConfidence": null,
      "lateralMeters": 0.67,
      "ttcSeconds": null,
      "approaching": null,
      "inEgoPath": null,
      "lightState": "GREEN",
      "lightConfidence": 0.858,
      "distanceAgeMs": 0.0
    }
  ],
  "signs": [
    {
      "id": 1000057,
      "signClass": "pedestrianCrossing",
      "bbox": [
        821.3,
        95.7,
        866.7,
        139.0
      ],
      "confidence": 0.611,
      "distanceMeters": 16.7
    }
  ],
  "lanes": {
    "currentLane": 1,
    "laneCount": 1,
    "laneBoundaries": [
      [
        [
          -310.7,
          387.6
        ],
        [
          -250.7,
          375.6
        ],
        [
          -190.7,
          363.6
        ],
        [
          -130.7,
          351.6
        ],
        [
          -70.7,
          339.6
        ],
        [
          -10.7,
          327.6
        ],
        [
          49.3,
          315.6
        ],
        [
          106.7,
          303.6
        ],
        [
          161.8,
          291.6
        ]
      ],
      [
        [
          -111.1,
          699.6
        ],
        [
          243.5,
          471.6
        ],
        [
          322.1,
          423.6
        ],
        [
          397.1,
          375.6
        ],
        [
          450.5,
          339.6
        ],
        [
          501.4,
          303.6
        ],
        [
          549.9,
          267.6
        ],
        [
          596.0,
          231.6
        ]
      ]
    ],
    "confidence": 0.551
  },
  "road": {
    "drivableCoverage": 0.094,
    "egoPathPolygon": [
      [
        -139.7,
        718.0
      ],
      [
        246.1,
        470.0
      ],
      [
        337.5,
        414.0
      ],
      [
        399.6,
        374.0
      ],
      [
        458.6,
        334.0
      ],
      [
        503.7,
        302.0
      ],
      [
        557.3,
        262.0
      ],
      [
        598.1,
        230.0
      ],
      [
        658.0,
        230.0
      ],
      [
        1800.8,
        718.0
      ]
    ],
    "horizonY": 198.8,
    "vanishingPoint": null,
    "anchorPoints": [
      {
        "name": "ego_lane_center_near",
        "xy": [
          799.9,
          640.1
        ],
        "groundXZ": [
          0.65,
          2.53
        ],
        "valid": true
      },
      {
        "name": "ego_lane_center_mid",
        "xy": [
          748.9,
          510.3
        ],
        "groundXZ": [
          0.63,
          3.76
        ],
        "valid": true
      },
      {
        "name": "ego_lane_center_far",
        "xy": [
          700.1,
          380.5
        ],
        "groundXZ": [
          0.6,
          6.73
        ],
        "valid": true
      }
    ]
  },
  "blockAges": {
    "detection": 0,
    "tracking": 0,
    "lights": 0,
    "distance": 3,
    "depth": 3,
    "lanes": 3,
    "signs": 6,
    "road": 3
  },
  "timingsMs": {
    "detect": 34.7,
    "track": 21.29,
    "trackStatic": 5.13,
    "lights": 8.63,
    "total": 69.82,
    "queueWait": 24.98,
    "fastLane": 69.91
  },
  "wave": 1,
  "echo": null
}
